Issue_ID,Issue_Description,Error_Message,System_Specs,Troubleshooting_Steps
1.0,Windows update failed to install,Error 0x80070005,Windows 10 Version 1903,1. Restart your PC and try updating again. 2. Run the Windows Update Troubleshooter. 3. Check your internet connection. 4. Disable your antivirus temporarily. 5. Free up disk space.
2.0,Web pages not loading correctly in Chrome,,Windows 10 Version 2004 Chrome Version 88.0.4324.190,1. Clear Chrome's cache and cookies. 2. Disable browser extensions to see if they might be causing an issue. 3. Update your browser to the latest version. 4. Try viewing the page in a different browser.
3.0,Outlook crashes when sending email,Error 0xc0000005,Office 365 Windows 10 Version 1909,1. Check for updates and install if any available. 2. Repair the Office app through the Control Panel. 3. Disable add-ins in Outlook. 4. Reinstall the Outlook app.
4.0,Slow performance after Windows 10 update,,Windows 10 Version 21H1,1. Check for the latest device drivers. 2. Adjust power settings for better performance. 3. Disable startup programs. 4. Run Windows Performance Troubleshooter. 5. Upgrade hardware if necessary.
5.0,Blue screen error on startup,SYSTEM_THREAD_EXCEPTION_NOT_HANDLED,Windows 10 Version 20H2,1. Boot in Safe Mode and uninstall recent updates. 2. Check for memory issues using Windows Memory Diagnostic. 3. Update graphics drivers. 4. Perform a system restore.
6.0,Printer not responding,,Windows 10 Printer Model XYZ,1. Check printer connections and restart it. 2. Update printer drivers. 3. Clear print queue and restart the print spooler. 4. Test the printer on another device.
7.0,Audio not working after Windows update,,Windows 10 Version 21H2,1. Check audio settings and ensure the correct playback device. 2. Update audio drivers. 3. Run the Windows Audio Troubleshooter. 4. Rollback the audio driver if recent update caused issues.
8.0,Wi-Fi connection drops frequently,,Windows 10 Wi-Fi Router Model ABC,1. Restart the router and reconnect. 2. Update Wi-Fi drivers on the PC. 3. Adjust power settings for the Wi-Fi adapter. 4. Disable and re-enable Wi-Fi on the PC.
9.0,External hard drive not recognized,,Windows 10 External HDD Model XYZ,1. Check USB connections and try a different port. 2. Update USB drivers. 3. Test the hard drive on another PC. 4. Run disk management to check for drive recognition issues.
10.0,File not found error in File Explorer,,Windows 10 Version 21H1,1. Check for malware using antivirus software. 2. Perform a system file check using SFC /scannow command. 3. Reset File Explorer settings to default. 4. Check for Windows updates.
11.0,Application crashes on startup,Error 0x80004003,Windows 11 Version 21H2,1. Check for application updates. 2. Run the application in compatibility mode. 3. Disable unnecessary startup programs. 4. Reinstall the application.
12.0,Slow internet connection,,"Windows 10, Wi-Fi Router Model XYZ",1. Restart the router and modem. 2. Check for interference from other devices. 3. Update Wi-Fi drivers on the PC. 4. Contact your internet service provider for assistance.
13.0,Bluetooth not working,Error 0x80070422,"Windows 10 Version 21H1, Bluetooth Version 4.2",1. Restart the computer and Bluetooth device. 2. Update Bluetooth drivers. 3. Check if Bluetooth is enabled in settings. 4. Remove and re-pair devices.
14.0,File access denied,Error 0x80070005,Windows 10 Version 20H2,1. Take ownership of the file or folder. 2. Check file permissions. 3. Disable antivirus temporarily. 4. Run a malware scan. 5. Perform a system file check using SFC /scannow.
15.0,Battery not charging,Error 0xc0000189,"Windows 10 Version 21H2, Laptop Model ABC",1. Check power adapter and cable. 2. Update battery drivers. 3. Restart the laptop. 4. Perform a battery calibration. 5. Check for BIOS updates.
16.0,Software installation failed,,Windows 11 Version 21H1,1. Run the installer as an administrator. 2. Check for system requirements. 3. Temporarily disable antivirus. 4. Verify the installer integrity. 5. Contact software support for assistance.
17.0,External monitor not detected,,"Windows 10, Graphics Card Model XYZ",1. Check cable connections. 2. Update graphics drivers. 3. Press Win + P and select the appropriate display mode. 4. Test the monitor on another computer.
18.0,Mouse cursor freezing,,"Windows 10 Version 1909, Mouse Model XYZ",1. Check for driver updates. 2. Clean the mouse sensor. 3. Try a different USB port. 4. Test the mouse on another computer. 5. Disable power-saving for USB devices.
19.0,Error accessing shared folder,Error 0x80070035,"Windows 10 Version 21H2, Network Drive Model ABC",1. Check network connections. 2. Ensure sharing is enabled. 3. Verify folder permissions. 4. Disable firewall temporarily. 5. Restart the network router.
20.0,Application not responding,Error 0xc0000142,Windows 10 Version 2004,1. Close and restart the application. 2. Check for application updates. 3. Disable unnecessary background processes. 4. Run a system file check using SFC /scannow.
21.0,Printer printing blank pages,,"Windows 10, Printer Model ABC",1. Check ink or toner levels. 2. Clean printheads. 3. Update printer drivers. 4. Run a test print. 5. Check for Windows updates related to the printer.
22.0,Taskbar icons missing,,Windows 10 Version 21H1,1. Restart Windows Explorer from Task Manager. 2. Check for Windows updates. 3. Run the System File Checker (SFC). 4. Rebuild the icon cache. 5. Create a new user profile.
23.0,Game crashes during gameplay,Error 0xc0000005,"Windows 10 Version 1903, Game Title XYZ",1. Update graphics drivers. 2. Verify game files integrity. 3. Check for game updates. 4. Adjust in-game graphics settings. 5. Disable background applications.
24.0,Unable to open Control Panel,,Windows 10 Version 21H2,1. Open Control Panel from the Run dialog (Win + R). 2. Run the System File Checker (SFC). 3. Perform a Windows Update. 4. Check for malware using antivirus software.
25.0,USB device not recognized,Error 0x80070043,"Windows 10 Version 20H2, USB Device Model XYZ",1. Try a different USB port. 2. Update USB drivers. 3. Check the USB device on another computer. 4. Disable USB selective suspend. 5. Restart the computer.
26.0,Random system freezes,,"Windows 10, Laptop Model ABC",1. Check for system updates. 2. Update graphics drivers. 3. Run a memory diagnostic. 4. Disable unnecessary startup programs. 5. Check for overheating issues.
27.0,Error saving file in Microsoft Word,Error 0x80070057,"Windows 10 Version 21H1, Microsoft Word 2019",1. Save the file in a different format. 2. Check for updates in Microsoft Word. 3. Repair Microsoft Office through Control Panel. 4. Check available disk space.
28.0,Unable to play DVDs,Error 0xc00d36fa,"Windows 10 Version 21H2, DVD Drive Model ABC",1. Update DVD drive firmware. 2. Try a different DVD player software. 3. Check for Windows updates. 4. Clean the DVD disc. 5. Test with a different DVD.
29.0,VPN connection issues,,"Windows 11 Version 21H2, VPN Client XYZ",1. Check internet connection. 2. Update VPN client software. 3. Verify VPN server details. 4. Restart the router. 5. Contact VPN service provider for assistance.
30.0,Error opening Photos app,Error 0x80070002,"Windows 10 Version 2004, Microsoft Photos",1. Check for updates in Microsoft Store. 2. Reset the Photos app. 3. Run the Windows Apps Troubleshooter. 4. Check for Windows updates. 5. Reinstall the Photos app.
31.0,Internet browser crashes,,"Windows 10, Browser Version XYZ",1. Clear browser cache and cookies. 2. Disable browser extensions. 3. Update the browser to the latest version. 4. Try using a different browser.
32.0,Error connecting to Wi-Fi network,Error 0x8007045d,"Windows 11 Version 21H2, Wi-Fi Router Model ABC",1. Forget and reconnect to the Wi-Fi network. 2. Restart the router and modem. 3. Update Wi-Fi drivers on the PC. 4. Run the Windows Network Troubleshooter.
33.0,External monitor color issues,,"Windows 10 Version 21H1, Graphics Card Model XYZ",1. Update graphics drivers. 2. Check display cable connections. 3. Adjust monitor color settings. 4. Test the monitor on another computer. 5. Restart the PC.
34.0,Error saving Excel file,Error 0x8007007e,"Windows 10 Version 20H2, Microsoft Excel 365",1. Save the file in a different location. 2. Check for updates in Microsoft Excel. 3. Repair Microsoft Office through Control Panel. 4. Verify file permissions.
35.0,Application freezes during video calls,Error 0xc0000417,"Windows 10 Version 21H2, Video Conferencing App XYZ",1. Update graphics drivers. 2. Check for application updates. 3. Adjust video call settings. 4. Disable unnecessary background applications. 5. Restart the computer.
36.0,Error accessing USB drive,Error 0x80070571,"Windows 10 Version 2004, USB Drive Model XYZ",1. Try a different USB port. 2. Update USB drivers. 3. Check for disk errors using CHKDSK. 4. Test the USB drive on another computer. 5. Run a virus scan on the USB drive.
37.0,System clock synchronization issue,,Windows 10 Version 21H2,1. Update date and time settings. 2. Restart the Windows Time service. 3. Check for Windows updates. 4. Try a different time server. 5. Reset the BIOS/UEFI clock settings.
38.0,Error opening PDF files,Error 0xc000022,"Windows 10 Version 1903, Adobe Acrobat Reader",1. Update Adobe Acrobat Reader. 2. Try a different PDF reader. 3. Repair Adobe Acrobat Reader through Control Panel. 4. Check for file corruption in PDF files.
39.0,Taskbar not responding,Error 0xc00007b,Windows 11 Version 21H1,1. Restart Windows Explorer from Task Manager. 2. Check for Windows updates. 3. Run the System File Checker (SFC). 4. Rebuild the taskbar settings. 5. Create a new user profile.
40.0,Error printing from web browser,Error 0x8007007e,"Windows 10 Version 21H2, Browser Version ABC",1. Try a different browser. 2. Update printer drivers. 3. Clear browser cache and cookies. 4. Check for Windows updates. 5. Restart the computer and printer.
41.0,Bluetooth device not pairing,Error 0x80070057,"Windows 10 Version 20H2, Bluetooth Device Model XYZ",1. Ensure Bluetooth is enabled on both devices. 2. Forget and re-pair the Bluetooth device. 3. Update Bluetooth drivers. 4. Restart the computer and Bluetooth device.
42.0,Error accessing mapped network drive,Error 0x80004005,"Windows 10 Version 21H1, Network Drive Model ABC",1. Re-map the network drive. 2. Check network permissions. 3. Restart the computer and router. 4. Run the Windows Network Troubleshooter. 5. Disable and re-enable network adapter.
43.0,Application not launching,Error 0xc0000142,Windows 10 Version 2004,1. Check for application updates. 2. Run the application as an administrator. 3. Disable antivirus temporarily. 4. Reinstall the application. 5. Check for Windows updates.
44.0,Error connecting to VPN,Error 0x800704d4,"Windows 11 Version 21H2, VPN Client XYZ",1. Check internet connection. 2. Verify VPN server details. 3. Update VPN client software. 4. Restart the router. 5. Contact VPN service provider for assistance.
45.0,Unexpected shutdowns,,Windows 10 Version 1909,1. Check for overheating issues. 2. Verify power supply connections. 3. Run a system file check using SFC /scannow. 4. Check for hardware issues using Windows Memory Diagnostic. 5. Update device drivers.
46.0,Error copying files,Error 0x80070057,Windows 10 Version 21H2,1. Check destination folder permissions. 2. Run the System File Checker (SFC). 3. Disable antivirus temporarily. 4. Check for disk errors using CHKDSK. 5. Update device drivers.
47.0,Application UI distorted,Error 0xc0000417,"Windows 10 Version 21H1, Application XYZ",1. Update graphics drivers. 2. Check for application updates. 3. Adjust application display settings. 4. Test the application on a different computer. 5. Restart the computer.
48.0,Error sending emails,Error 0x80042109,"Windows 10 Version 20H2, Email Client XYZ",1. Check internet connection. 2. Update email client software. 3. Verify email server settings. 4. Disable antivirus temporarily. 5. Contact email service provider for assistance.
49.0,Windows Store app not downloading,Error 0x80244018,"Windows 10 Version 21H2, Microsoft Store",1. Check internet connection. 2. Clear Microsoft Store cache. 3. Restart Windows Update service.
50.0,Error playing audio,Error 0xc00d11d1,Windows 10 Version 21H2,1. Check audio settings. 2. Update audio drivers. 3. Run the Windows Audio Troubleshooter. 4. Restart the audio service. 5. Test with different audio devices.
51.0,USB device malfunction,Error 0x8007001F,"Windows 10 Version 2004, USB Device Model ABC",1. Try a different USB port. 2. Update USB drivers. 3. Test the USB device on another computer. 4. Run Windows Update. 5. Check for hardware issues with the USB device.
52.0,Error installing graphics driver,Error 0x80070103,"Windows 11 Version 21H2, Graphics Card Model ABC",1. Download and install the latest graphics driver from the manufacturer's website. 2. Uninstall the current graphics driver and reinstall. 3. Check for Windows updates. 4. Restart the computer after installation.
53.0,Printer spooler error,,"Windows 10, Printer Model XYZ",1. Restart the Print Spooler service. 2. Clear the print queue. 3. Update printer drivers. 4. Delete and reinstall the printer. 5. Check for Windows updates related to printing.
54.0,Error accessing camera,Error 0xA00F4244,"Windows 10 Version 21H1, Camera Model ABC",1. Check camera connections. 2. Update camera drivers. 3. Check privacy settings for camera access. 4. Test the camera with a different application. 5. Restart the computer.
55.0,Error connecting to shared printer,Error 0x00000002,"Windows 10 Version 20H2, Shared Printer Model XYZ",1. Check printer connections. 2. Verify permissions on the shared printer. 3. Reconnect to the shared printer. 4. Restart the Print Spooler service. 5. Check for Windows updates.
56.0,Application crashes on startup,Error 0xc000007b,"Windows 11 Version 21H2, Application XYZ",1. Check for application updates. 2. Run the application as an administrator. 3. Update Microsoft Visual C++ Redistributable. 4. Reinstall the application. 5. Check for Windows updates.
57.0,Error connecting to mobile hotspot,Error 0x80070490,"Windows 10 Version 21H2, Mobile Hotspot",1. Restart the computer and mobile device. 2. Update Wi-Fi drivers. 3. Forget and reconnect to the mobile hotspot. 4. Check mobile hotspot settings. 5. Run the Windows Network Troubleshooter.
58.0,Error opening Microsoft Edge,Error 0x800421F,"Windows 10 Version 2004, Microsoft Edge",1. Check for Microsoft Edge updates. 2. Clear browser cache and cookies. 3. Disable Microsoft Edge extensions. 4. Reset Microsoft Edge settings. 5. Check for Windows updates.
59.0,Error connecting to VPN,Error 0x800B010F,"Windows 11 Version 21H2, VPN Client ABC",1. Check internet connection. 2. Verify VPN server details. 3. Update VPN client software. 4. Restart the router. 5. Contact VPN service provider for assistance.
60.0,Error accessing external hard drive,Error 0x80070015,"Windows 10 Version 1909, External HDD Model ABC",1. Check USB connections. 2. Try a different USB port. 3. Update USB drivers. 4. Test the hard drive on another computer. 5. Run disk management to check for drive recognition issues.
61.0,Error playing video files,Error 0xc1010103,"Windows 10 Version 21H1, Media Player XYZ",1. Update media player software. 2. Check video file format compatibility. 3. Update graphics drivers. 4. Run the Windows Media Player Troubleshooter. 5. Check for Windows updates.
62.0,Error connecting to OneDrive,Error 0x8004def6,"Windows 10 Version 21H2, OneDrive",1. Check internet connection. 2. Update OneDrive to the latest version. 3. Reset OneDrive settings. 4. Run the Windows Apps Troubleshooter. 5. Check for Windows updates.
63.0,Error opening PowerPoint files,Error 0x80070643,"Windows 10 Version 20H2, Microsoft PowerPoint 365",1. Check for updates in Microsoft PowerPoint. 2. Repair Microsoft Office through Control Panel. 3. Try opening the PowerPoint file on another computer. 4. Check for file corruption in PowerPoint files.
64.0,Error connecting to a remote desktop,Error 0x204,"Windows 10 Version 21H2, Remote Desktop Connection",1. Verify remote desktop settings. 2. Check for network connectivity. 3. Restart the remote desktop service. 4. Update remote desktop client software. 5. Run the Windows Network Troubleshooter.
65.0,Error scanning documents,Error 0x80070490,"Windows 10 Version 2004, Scanner Model XYZ",1. Check scanner connections. 2. Update scanner drivers. 3. Restart the computer and scanner. 4. Test the scanner with a different application. 5. Check for Windows updates.
66.0,Error opening Word files,Error 0x80070005,"Windows 10 Version 21H2, Microsoft Word 2019",1. Check for updates in Microsoft Word. 2. Repair Microsoft Office through Control Panel. 3. Try opening the Word file on another computer. 4. Check for file corruption in Word files.
67.0,Error connecting to a network printer,Error 0x00000709,"Windows 10 Version 20H2, Network Printer Model ABC",1. Check printer connections. 2. Verify permissions on the network printer. 3. Reconnect to the network printer. 4. Restart the Print Spooler service. 5. Check for Windows updates.
68.0,Error updating Windows,Error 0x800f0831,Windows 10 Version 21H1,1. Run the Windows Update Troubleshooter. 2. Clear the Windows Update cache. 3. Disable antivirus temporarily. 4. Manually download and install Windows updates. 5. Check for pending restarts.
69.0,Error opening Excel files,Error 0xc0000142,"Windows 10 Version 1903, Microsoft Excel 365",1. Check for updates in Microsoft Excel. 2. Repair Microsoft Office through Control Panel. 3. Try opening the Excel file on another computer. 4. Check for file corruption in Excel files.
70.0,Error connecting to a Bluetooth keyboard,Error 0x80070015,"Windows 10 Version 21H1, Bluetooth Keyboard XYZ",1. Check Bluetooth settings. 2. Verify battery level on the Bluetooth keyboard. 3. Forget and re-pair the Bluetooth keyboard. 4. Update Bluetooth drivers. 5. Restart the computer and Bluetooth device.
71.0,Error playing music,Error 0xc00d36fa,Windows 10 Version 21H2 Media Player,1. Update media player software. 2. Check music file format compatibility. 3. Update audio drivers. 4. Run the Windows Media Player Troubleshooter. 5. Check for Windows updates.
72.0,Error opening a specific application,Error 0xc000007b,"Windows 10 Version 2004, Application XYZ",1. Check for updates in the application. 2. Run the application as an administrator. 3. Update Microsoft Visual C++ Redistributable. 4. Reinstall the application. 5. Check for Windows updates.
73.0,Error connecting to a specific Wi-Fi network,Error 0x8007045d,"Windows 10 Version 21H2, Wi-Fi Network XYZ",1. Forget and reconnect to the Wi-Fi network. 2. Restart the router and modem. 3. Update Wi-Fi drivers on the PC. 4. Run the Windows Network Troubleshooter. 5. Contact the network administrator for assistance.
74.0,Error accessing a specific website in Firefox,,"Windows 11 Version 21H2, Firefox Version XYZ",1. Clear Firefox's cache and cookies. 2. Disable browser extensions. 3. Update Firefox to the latest version. 4. Try accessing the website in a different browser. 5. Restart the computer.
75.0,Error saving changes in a specific document,Error 0x800703ee,"Windows 10 Version 2004, Document XYZ",1. Save the document with a different name. 2. Check for updates in the associated application. 3. Repair the application through Control Panel. 4. Try saving the document in a different format. 5. Check for file corruption using file recovery tools.
76.0,Error connecting to a specific VPN server,Error 0x800B010F,"Windows 11 Version 21H2, VPN Server XYZ",1. Check internet connection. 2. Verify VPN server details. 3. Update VPN client software. 4. Restart the router. 5. Contact the VPN service provider for assistance.
77.0,Error opening a specific folder in File Explorer,Error 0x80070057,Windows 10 Version 21H2,1. Check folder permissions. 2. Run the System File Checker (SFC). 3. Try accessing the folder from Command Prompt. 4. Disable antivirus temporarily. 5. Check for file system errors using CHKDSK.
78.0,Error connecting to a specific printer,Error 0x00000709,"Windows 10 Version 20H2, Printer Model XYZ",1. Check printer connections. 2. Verify permissions on the printer. 3. Reconnect to the printer. 4. Restart the Print Spooler service. 5. Check for Windows updates related to printing.
79.0,Error opening a specific email attachment,Error 0x80070005,"Windows 10 Version 21H2, Email Client XYZ",1. Check for updates in the email client. 2. Repair the email client through Control Panel. 3. Try opening the email attachment on another computer. 4. Check for file corruption in the email attachment. 5. Verify available disk space.
80.0,Error accessing a specific network drive,Error 0x80004005,"Windows 10 Version 21H1, Network Drive XYZ",1. Re-map the network drive. 2. Check network permissions. 3. Restart the computer and router. 4. Run the Windows Network Troubleshooter. 5. Disable and re-enable the network adapter.
81.0,Error connecting to a specific remote desktop,Error 0x204,"Windows 10 Version 21H2, Remote Desktop XYZ",1. Verify remote desktop settings. 2. Check for network connectivity. 3. Restart the remote desktop service. 4. Update remote desktop client software. 5. Run the Windows Network Troubleshooter.
82.0,Error scanning documents with a specific scanner,Error 0x8007001F,"Windows 10 Version 1909, Scanner Model ABC",1. Check scanner connections. 2. Update scanner drivers. 3. Restart the computer and scanner. 4. Test the scanner with a different application. 5. Check for Windows updates.
83.0,Error playing a specific music file,Error 0xc00d36fa,"Windows 10 Version 21H2, Media Player XYZ",1. Update media player software. 2. Check music file format compatibility. 3. Update audio drivers. 4. Run the Windows Media Player Troubleshooter. 5. Check for Windows updates.
84.0,Error connecting to a specific website in Edge,,"Windows 10 Version 21H2, Microsoft Edge",1. Clear Edge's cache and cookies. 2. Disable Edge extensions. 3. Update Edge to the latest version. 4. Try accessing the website in a different browser. 5. Restart the computer.
85.0,Error saving changes in a specific spreadsheet,Error 0x80070246,"Windows 10 Version 2004, Microsoft Excel 365",1. Save the spreadsheet with a different name. 2. Check for updates in Microsoft Excel. 3. Repair Microsoft Office through Control Panel. 4. Try saving the spreadsheet in a different format. 5. Check for file corruption using file recovery tools.
86.0,Error connecting to a specific gaming server,Error 0x80070102,"Windows 11 Version 21H2, Gaming Platform XYZ",1. Check internet connection. 2. Verify gaming server details. 3. Update gaming platform software. 4. Restart the router. 5. Contact the gaming platform support for assistance.
87.0,Error opening a specific photo file,Error 0xc00d36fa,"Windows 10 Version 21H2, Photo Viewer XYZ",1. Update photo viewer software. 2. Check photo file format compatibility. 3. Update graphics drivers. 4. Run the Windows Photo Viewer Troubleshooter. 5. Check for Windows updates.
88.0,Error connecting to a specific database,Error 0x80004005,"Windows 10 Version 21H1, Database Server XYZ",1. Check database server connection. 2. Verify database credentials. 3. Restart the database server. 4. Update database client software. 5. Run the Windows Network Troubleshooter.
89.0,Error accessing a specific cloud storage,Error 0x80070490,"Windows 10 Version 2004, Cloud Storage XYZ",1. Check internet connection. 2. Update cloud storage client software. 3. Reset cloud storage settings. 4. Run the Windows Apps Troubleshooter. 5. Check for Windows updates.
90.0,Error playing a specific video game,Error 0xc0000005,"Windows 10 Version 21H2, Video Game XYZ",1. Update graphics drivers. 2. Verify game files integrity. 3. Check for game updates. 4. Adjust in-game graphics settings. 5.
91.0,Error connecting to a specific printer,Error 0x00000709,"Windows 10 Version 20H2, Printer Model XYZ",1. Check printer connections. 2. Verify permissions on the printer. 3. Reconnect to the printer. 4. Restart the Print Spooler service. 5. Check for Windows updates related to printing.
92.0,Error opening a specific email attachment,Error 0x80070005,"Windows 10 Version 21H2, Email Client XYZ",1. Check for updates in the email client. 2. Repair the email client through Control Panel. 3. Try opening the email attachment on another computer. 4. Check for file corruption in the email attachment. 5. Verify available disk space.
93.0,Error accessing a specific network drive,Error 0x80004005,"Windows 10 Version 21H1, Network Drive XYZ",1. Re-map the network drive. 2. Check network permissions. 3. Restart the computer and router. 4. Run the Windows Network Troubleshooter. 5. Disable and re-enable the network adapter.
94.0,Error connecting to a specific remote desktop,Error 0x204,"Windows 10 Version 21H2, Remote Desktop XYZ",1. Verify remote desktop settings. 2. Check for network connectivity. 3. Restart the remote desktop service. 4. Update remote desktop client software. 5. Run the Windows Network Troubleshooter.
95.0,Error scanning documents with a specific scanner,Error 0x8007001F,"Windows 10 Version 1909, Scanner Model ABC",1. Check scanner connections. 2. Update scanner drivers. 3. Restart the computer and scanner. 4. Test the scanner with a different application. 5. Check for Windows updates.
96.0,Error playing a specific music file,Error 0xc00d36fa,"Windows 10 Version 21H2, Media Player XYZ",1. Update media player software. 2. Check music file format compatibility. 3. Update audio drivers. 4. Run the Windows Media Player Troubleshooter. 5. Check for Windows updates.
97.0,Error connecting to a specific website in Edge,,"Windows 10 Version 21H2, Microsoft Edge",1. Clear Edge's cache and cookies. 2. Disable Edge extensions. 3. Update Edge to the latest version. 4. Try accessing the website in a different browser. 5. Restart the computer.
