Issue_ID,Issue_Description,Error_Message,System_Specs,Troubleshooting_Steps
,Unable to access the mapped drive due to 'The network connection was lost' error.,,,1. Check for network interruptions or stability issues. 2. Reconnect the mapped drive manually. 3. Investigate any recent changes to network configurations.
,Facing 'A security package specific error occurred' when mapping the drive.,,,1. Check for issues with the security package. 2. Verify network settings and try mapping to the drive again. 3. Ensure the security package is up-to-date.
,Mapped drive becomes inaccessible after an OS update.,,,1. Check the compatibility of the mapped drive with the updated OS. 2. Reconnect the mapped drive manually. 3. Consider updating the drive software or drivers.
,Encountering 'The specified network name is no longer available' while accessing the mapped drive.,,,1. Check for network connectivity issues. 2. Reconnect the mapped drive manually. 3. Investigate any recent changes to network configurations.
,Mapped drive prompts 'There is a duplicate name on the network'.,,,1. Disconnect the existing mapped drive. 2. Clear any residual connections to the drive. 3. Re-map the drive with a different name.
,Unable to map the drive due to 'The specified network resource or device is no longer available' error.,,,1. Check the availability of the network resource or device. 2. Verify network settings and try mapping to the drive again. 3. Ensure the resource or device is accessible.
,Facing 'The specified network resource or device is no longer available' during file access on the mapped drive.,,,1. Check for network interruptions or stability issues. 2. Reconnect the mapped drive manually. 3. Investigate any recent changes to network configurations.
,Mapped drive shows as 'Disconnected' despite an active network connection.,,,1. Check for network interruptions or congestion. 2. Restart the computer and check the mapped drive status. 3. Reconnect the mapped drive manually if needed.
,Encountering 'The semaphore timeout period has expired' intermittently while accessing the mapped drive.,,,1. Check for network interruptions or congestion. 2. Reconnect the mapped drive manually. 3. Investigate any recent changes to network configurations.
,Mapped drive prompts 'The specified server cannot perform the requested operation'.,,,1. Verify server settings and capabilities. 2. Check for any recent changes to server operations. 3. Ensure network connectivity to the server is stable.
,Unable to access specific files on the mapped drive due to 'Access Denied'.,,,1. Check file-level permissions on the mapped drive. 2. Verify if the user account has the necessary access rights. 3. Investigate specific files triggering the 'Access Denied' error.
,Facing 'The network BIOS command limit has been reached' when accessing the mapped drive.,,,"1. Check for network congestion or limitations. 2. Verify BIOS settings on the involved systems. 3. If the issue persists, consider adjusting BIOS settings or network configurations."
,Mapped drive becomes inaccessible after a firewall configuration change.,,,1. Review recent changes to firewall settings affecting drive access.
,Disruptions due to pending reboots for Windows updates,,"Windows 10 Pro, Intel i7, 16GB RAM","1. Check Windows Update settings and install any pending updates. 2. Schedule a system restart during non-working hours. 3. Set up ""Active Hours"" to prevent automatic restarts. 4. Verify and adjust Windows Update settings."
,O365/M365 technical difficulties,Unable to access O365 services,"Windows 11, Microsoft Edge",1. Check Microsoft 365 Service Status for ongoing issues. 2. Clear browser cache and cookies. 3. Update the web browser to the latest version. 4. Visit Microsoft 365 Help Center for self-help resources. 5. Contact Microsoft Support for personalized assistance. 6. Monitor online forums for reported outages affecting Microsoft 365 services.
,Pending reboots affecting system performance,"System slowdown, occasional freezes","Windows 8.1, AMD Ryzen 5, 8GB RAM","1. Ensure all pending Windows updates are downloaded and installed. 2. Schedule a specific restart time to complete updates. 3. Use ""Active Hours"" to prevent automatic restarts during work hours. 4. Check for conflicts with third-party software. 5. Consider adjusting Windows Update settings for a balance between updates and disruptions."
,Technical difficulties with O365/M365 applications,"Unable to open Outlook, Excel crashing frequently","macOS Big Sur, MacBook Pro",1. Check Microsoft 365 Service Status for reported issues. 2. Reinstall Microsoft Office applications. 3. Verify account credentials and permissions. 4. Explore online forums for application-specific troubleshooting. 5. Contact Microsoft Support for detailed assistance.
,Windows updates impacting O365/M365 functionality,"O365/M365 login issues, email synchronization delays","Windows 7, Intel Core i5, 4GB RAM","1. Prioritize and complete pending Windows updates. 2. Monitor O365/M365 Service Status for any ongoing disruptions. 3. Clear browser cache and cookies. 4. Update web browser to the latest version. 5. If issues persist, contact Microsoft Support for advanced troubleshooting."
,O365/M365 technical glitches,"OneNote not syncing, SharePoint access issues","Windows 10 Home, AMD Ryzen 7",1. Check Microsoft 365 Service Status for known issues. 2. Clear OneNote cache to resolve synchronization problems. 3. Verify SharePoint permissions and configurations. 4. Refer to Microsoft 365 Help Center for self-help guides. 5. Contact Microsoft Support for specialized assistance.
,Seeking expert assistance for O365/M365 technical challenges,,"Windows 10, Intel i5, 8GB RAM",1. Check Microsoft 365 Service Status for ongoing issues. 2. Clear browser cache and cookies. 3. Verify account credentials. 4. Contact Microsoft Support for expert assistance.
,Actively seeking expert guidance for O365/M365 issues,,"Windows 8.1, AMD Ryzen 7, 16GB RAM",1. Monitor Microsoft 365 Service Status. 2. Reinstall Microsoft Office applications. 3. Check for reported issues in online forums. 4. Contact Microsoft Support for specialized solutions.
,Computer indicating restart for pending Windows updates,,"Windows 11, Intel i7, 16GB RAM","1. Check Windows Update settings for pending updates. 2. Schedule a system restart during non-working hours. 3. Adjust ""Active Hours"" to prevent automatic restarts. 4. Troubleshoot any update-related errors."
,Difficulties encountered while restarting for Windows updates,,"Windows 7, AMD Ryzen 5, 12GB RAM",1. Manually initiate the restart from the Start menu. 2. Check for any conflicting applications. 3. Disable automatic restarts temporarily. 4. Run Windows Update troubleshooter.
,Challenges faced during computer restart for Windows updates,,"Windows 10 Pro, Intel i9, 32GB RAM",1. Investigate potential conflicts with third-party software. 2. Restart in Safe Mode before updating. 3. Use the Windows Update Assistant for manual updates. 4. Review system logs for update errors.
,System prompting restart for Windows updates with difficulties,,"Windows 8, AMD Ryzen 3, 8GB RAM",1. Check for pending updates in Windows Update settings. 2. Verify disk space availability. 3. Run the Windows Update troubleshooter. 4. Manually download and install updates if necessary.
,Difficulty in proceeding with computer restart for updates,,"Windows 10 Home, Intel i3, 4GB RAM",1. Close unnecessary applications before restarting. 2. Check for background processes causing delays. 3. Temporarily disable antivirus software. 4. Review Windows Event Viewer for error details.
,Facing obstacles during Windows updates restart,,"Windows 7, Intel i5, 16GB RAM",1. Investigate potential driver issues. 2. Run Windows Update troubleshooter. 3. Temporarily disable non-essential startup programs. 4. Consult Windows support forums for specific error resolutions.
,Challenges encountered in restarting for Windows updates,,"Windows 10, AMD Ryzen 9, 64GB RAM",1. Ensure network connectivity for update downloads. 2. Check for conflicting Windows services. 3. Use Command Prompt to force restart if necessary. 4. Monitor task manager for resource-intensive processes.
,Struggling to complete system restart for Windows updates,,"Windows 8.1, Intel i7, 16GB RAM",1. Review Windows Update history for failed installations. 2. Investigate potential malware interference. 3. Use System Restore to revert to a stable state. 4. Contact Windows support for advanced troubleshooting.
,Prolonged high CPU utilization causing slowdown,,"Windows 10, Intel i7, 16GB RAM",1. Identify and close resource-intensive applications. 2. Run a full system malware scan. 3. Check for outdated drivers and update if necessary. 4. Monitor Task Manager for processes causing high CPU usage.
,Consistent elevated CPU levels leading to reduced responsiveness,,"Windows 8.1, AMD Ryzen 5, 8GB RAM",1. Check for background processes consuming CPU resources. 2. Disable unnecessary startup programs. 3. Ensure adequate free disk space. 4. Consider upgrading hardware for improved performance.
,Persistent increase in CPU utilization impacting processing speeds,,"Windows 11, Intel i5, 12GB RAM",1. Review recent software installations for potential conflicts. 2. Adjust power settings for better CPU management. 3. Run Windows Update to ensure the system is up to date. 4. Consider upgrading RAM for enhanced multitasking capabilities.
,Continual rise in CPU utilization causing significant slowdown,,"Windows 7, AMD Ryzen 3, 4GB RAM",1. Examine recent system changes or updates. 2. Utilize Performance Monitor to identify CPU-intensive tasks. 3. Clean up temporary files and unnecessary applications. 4. Consider upgrading to a more powerful CPU if needed.
,Prolonged heightened CPU utilization impacting processing performance,,"macOS Big Sur, MacBook Pro",1. Check for background processes on macOS Activity Monitor. 2. Verify system for potential overheating issues. 3. Optimize startup items for improved boot times. 4. Monitor system resource usage regularly.
,Consistent elevation in CPU usage causing noticeable reduction,,"Windows 10, Intel i9, 32GB RAM",1. Investigate recent driver updates for compatibility issues. 2. Optimize Windows visual effects for improved performance. 3. Check for overheating and ensure proper ventilation. 4. Run a disk cleanup to free up storage space.
,Sustained high CPU utilization adversely affecting processing speeds,,"Windows 8, AMD Ryzen 7, 16GB RAM",1. Run a comprehensive antivirus scan for potential threats. 2. Optimize startup programs for faster boot times. 3. Consider upgrading to a Solid State Drive (SSD) for improved performance. 4. Check for Windows performance updates.
,Continuous spike in CPU usage causing noticeable sluggishness,,"Windows 10 Home, Intel i3, 8GB RAM",1. Identify and terminate unnecessary background processes. 2. Update graphics drivers for smoother performance. 3. Consider adjusting power plans for optimized CPU usage. 4. Review recent software installations for potential conflicts.
,Ongoing increase in CPU utilization contributing to processing decline,,"Windows 7, AMD Ryzen 5, 16GB RAM",1. Verify if there are pending Windows updates affecting performance. 2. Optimize Windows services for better resource management. 3. Check for malware using reputable antivirus software. 4. Evaluate the need for additional cooling solutions.
,Consistent rise in CPU usage leading to noticeable drop in speeds,,"Windows 10 Pro, Intel i5, 8GB RAM",1. Adjust system power settings to balance performance. 2. Consider upgrading to a more powerful CPU or additional RAM. 3. Run a disk cleanup to free up storage space. 4. Monitor for background processes causing prolonged CPU usage.
,Prolonged elevated CPU utilization hampering processing speeds,,"Windows 8.1, AMD Ryzen 9, 64GB RAM",1. Identify and close unnecessary running applications. 2. Check for system overheating and clean cooling components. 3. Evaluate the need for hardware upgrades. 4. Run Windows Update for the latest performance-related patches.
,Persistent high CPU usage causing noticeable deterioration,,"macOS Catalina, MacBook Air",1. Investigate background processes using Activity Monitor. 2. Optimize startup items for quicker boot times. 3. Consider upgrading to a newer macOS version for performance improvements. 4. Check for available storage space on the device.
,High CPU utilization causing decline in processing performance,,"Windows 10, Intel i7, 16GB RAM",1. Run a thorough malware scan to eliminate potential threats. 2. Monitor CPU temperatures for signs of overheating. 3. Check for software conflicts and update applications. 4. Consider upgrading to a more powerful CPU or additional RAM.
,Prolonged period of elevated CPU usage leading to slower processing,,"Windows 8.1, AMD Ryzen 5, 8GB RAM",1. Investigate recent software installations for potential conflicts. 2. Optimize Windows power settings for improved efficiency. 3. Check for available storage space on the system drive. 4. Run a system diagnostic to identify performance bottlenecks.
,Consistently grappling with elevated CPU utilization diminishing efficiency,,"Windows 10 Home, Intel i3, 4GB RAM",1. Review recently installed applications for resource usage. 2. Consider upgrading to a Solid State Drive (SSD) for faster read/write speeds. 3. Adjust Windows startup items for quicker boot times. 4. Check for available system updates.
,Continuous spike in CPU utilization negatively impacting speeds,,"Windows 7, Intel i5, 12GB RAM",1. Monitor Task Manager for applications causing spikes in CPU usage. 2. Optimize Windows performance settings. 3. Check for software conflicts or outdated drivers. 4. Run a comprehensive antivirus scan for potential threats.
,Prolonged periods of high CPU usage leading to decreased speeds,,"Windows 10, AMD Ryzen 9, 32GB RAM",1. Investigate recent software installations for potential conflicts. 2. Optimize Windows visual effects for improved performance. 3. Monitor CPU temperatures to avoid overheating. 4. Consider upgrading hardware components for better efficiency.
,Persistent high CPU utilization causing slower processing speeds,,"Windows 8, AMD Ryzen 7, 16GB RAM",1. Identify and terminate unnecessary background processes. 2. Check for outdated device drivers and update if needed. 3. Consider upgrading hardware components for improved performance. 4. Monitor Task Manager for applications causing prolonged CPU usage.
,Continuous increase in CPU usage resulting in diminished efficiency,,"Windows 10 Pro, Intel i9, 64GB RAM",1. Optimize Windows startup items for faster boot times. 2. Check for malware using reputable antivirus software. 3. Consider upgrading to a more powerful CPU or additional RAM. 4. Run a disk cleanup to free up storage space.
,Prolonged high CPU usage causing slower processing speeds and efficiency,,"Windows 7, AMD Ryzen 5, 12GB RAM",1. Review recently installed applications for resource usage. 2. Check for system overheating and clean cooling components. 3. Run a system diagnostic to identify performance bottlenecks. 4. Consider upgrading hardware components for better efficiency.
,Sustained high CPU usage causing decrease in processing speeds,,"Windows 10, Intel i7, 16GB RAM",1. Identify and close resource-intensive applications. 2. Run a full system malware scan. 3. Check for outdated drivers and update if necessary. 4. Monitor Task Manager for processes causing high CPU usage.
,Prolonged elevation in CPU utilization leading to processing slowdown,,"Windows 8.1, AMD Ryzen 5, 8GB RAM",1. Check for background processes consuming CPU resources. 2. Disable unnecessary startup programs. 3. Ensure adequate free disk space. 4. Consider upgrading hardware for improved performance.
,Unusually high CPU levels causing noticeable slowdown,,"Windows 11, Intel i5, 12GB RAM",1. Review recent software installations for potential conflicts. 2. Adjust power settings for better CPU management. 3. Run Windows Update to ensure the system is up to date. 4. Consider upgrading RAM for enhanced multitasking capabilities.
,Persistent high CPU utilization causing slowdown in processing speeds,,"Windows 7, AMD Ryzen 3, 4GB RAM",1. Examine recent system changes or updates. 2. Utilize Performance Monitor to identify CPU-intensive tasks. 3. Clean up temporary files and unnecessary applications. 4. Consider upgrading to a more powerful CPU if needed.
,Continual rise in CPU usage leading to slower processing speeds,,"macOS Big Sur, MacBook Pro",1. Check for background processes on macOS Activity Monitor. 2. Verify system for potential overheating issues. 3. Optimize startup items for improved boot times. 4. Monitor system resource usage regularly.
,Consistent elevation in CPU usage hampering processing speeds,,"Windows 10, Intel i9, 32GB RAM",1. Investigate recent driver updates for compatibility issues. 2. Optimize Windows visual effects for improved performance. 3. Check for overheating and ensure proper ventilation. 4. Run a disk cleanup to free up storage space.
,Ongoing high CPU usage causing decline in processing speeds,,"Windows 8, AMD Ryzen 7, 16GB RAM",1. Run a comprehensive antivirus scan for potential threats. 2. Optimize startup programs for faster boot times. 3. Consider upgrading to a Solid State Drive (SSD) for improved performance. 4. Check for Windows performance updates.
,Sustained high CPU utilization resulting in sluggish processing,,"Windows 10 Home, Intel i3, 8GB RAM",1. Identify and terminate unnecessary background processes. 2. Update graphics drivers for smoother performance. 3. Consider adjusting power plans for optimized CPU usage. 4. Review recent software installations for potential conflicts.
,Constant elevation of CPU usage impacting processing speeds,,"Windows 7, AMD Ryzen 5, 16GB RAM",1. Verify if there are pending Windows updates affecting performance. 2. Optimize Windows services for better resource management. 3. Check for malware using reputable antivirus software. 4. Evaluate the need for additional cooling solutions.
,Consistent rise in CPU usage causing drop in operational efficiency,,"Windows 10 Pro, Intel i5, 8GB RAM",1. Adjust system power settings to balance performance. 2. Consider upgrading to a more powerful CPU or additional RAM. 3. Run a disk cleanup to free up storage space. 4. Monitor for background processes causing prolonged CPU usage.
,Prolonged elevated CPU utilization hampering processing speeds,,"Windows 8.1, AMD Ryzen 9, 64GB RAM",1. Identify and close unnecessary running applications. 2. Check for system overheating and clean cooling components. 3. Evaluate the need for hardware upgrades. 4. Run Windows Update for the latest performance-related patches.
,Persistent high CPU usage causing deterioration in processing,,"macOS Catalina, MacBook Air",1. Investigate background processes using Activity Monitor. 2. Optimize startup items for quicker boot times. 3. Consider upgrading to a newer macOS version for performance improvements. 4. Check for available storage space on the device.
,High CPU utilization causing decline in processing speeds,,"Windows 10, Intel i7, 16GB RAM",1. Run a thorough malware scan to eliminate potential threats. 2. Monitor CPU temperatures for signs of overheating. 3. Check for software conflicts and update applications. 4. Consider upgrading to a more powerful CPU or additional RAM.
,Prolonged period of elevated CPU usage leading to slower processing,,"Windows 8.1, AMD Ryzen 5, 8GB RAM",1. Investigate recent software installations for potential conflicts. 2. Optimize Windows power settings for improved efficiency. 3. Check for available storage space on the system drive. 4. Run a system diagnostic to identify performance bottlenecks.
,Consistently grappling with elevated CPU utilization diminishing efficiency,,"Windows 10 Home, Intel i3, 4GB RAM",1. Review recently installed applications for resource usage. 2. Consider upgrading to a Solid State Drive (SSD) for faster read/write speeds. 3. Adjust Windows startup items for quicker boot times. 4. Check for available system updates.
,Continuous spike in CPU utilization negatively impacting speeds,,"Windows 7, Intel i5, 12GB RAM",1. Monitor Task Manager for applications causing spikes in CPU usage. 2. Optimize Windows performance settings. 3. Check for software conflicts or outdated drivers. 4. Run a comprehensive antivirus scan for potential threats.
,Prolonged periods of high CPU usage leading to decreased speeds,,"Windows 10, AMD Ryzen 9, 32GB RAM",1. Investigate recent software installations for potential conflicts. 2. Optimize Windows visual effects for improved performance. 3. Monitor CPU temperatures to avoid overheating. 4. Consider upgrading hardware components for better efficiency.
,Persistent high CPU utilization causing slower processing speeds,,"Windows 8, AMD Ryzen 7, 16GB RAM",1. Identify and terminate unnecessary background processes. 2. Check for outdated device drivers and update if needed. 3. Consider upgrading hardware components for improved performance. 4. Monitor Task Manager for applications causing prolonged CPU usage.
,Continuous increase in CPU usage resulting in diminished efficiency,,"Windows 10 Pro, Intel i9, 64GB RAM",1. Optimize Windows startup items for faster boot times. 2. Check for malware using reputable antivirus software. 3. Consider upgrading to a more powerful CPU or additional RAM. 4. Run a disk cleanup to free up storage space.
,Prolonged high CPU usage causing slower processing speeds and efficiency,,"Windows 7, AMD Ryzen 5, 12GB RAM",1. Review recently installed applications for resource usage. 2. Check for system overheating and clean cooling components. 3. Run a system diagnostic to identify performance bottlenecks. 4. Consider upgrading hardware components for better efficiency.
,Technical obstacles impacting efficiency of O365/M365,0x00000000,"Windows 10, Intel i7, 16GB RAM",1. Check internet connectivity. 2. Clear browser cache and cookies. 3. Verify Microsoft 365 subscription status. 4. Reinstall Microsoft Office applications.
,Performance of O365/M365 hampered by technical issues,0x00000000,"Windows 8.1, AMD Ryzen 5, 8GB RAM",1. Run Office Repair Tool for software integrity. 2. Check for system updates and apply if available. 3. Verify account permissions for O365/M365 services. 4. Contact Microsoft Support for advanced troubleshooting.
,O365/M365 performance hindered by technical issues,0x80070002,"Windows 11, Intel i5, 12GB RAM",1. Verify system date and time settings. 2. Run SFC (System File Checker) scan for corrupted system files. 3. Disable antivirus temporarily for testing. 4. Review event logs for specific error details.
,"Proper functioning of O365/M365 compromised, seeking assistance",0x80070005,"Windows 7, AMD Ryzen 3, 4GB RAM",1. Check for pending Windows updates on the system. 2. Verify O365/M365 subscription status. 3. Run the Office Configuration Analyzer Tool. 4. Review recent software installations for conflicts.
,"Optimal performance of O365/M365 hindered, seeking help",0x80070057,"macOS Big Sur, MacBook Pro",1. Update macOS to the latest version. 2. Reinstall O365/M365 applications. 3. Check for disk space availability. 4. Verify user account permissions.
,"Disruptions in proper operation of O365/M365, seeking assistance",0x8007007E,"Windows 10, Intel i9, 32GB RAM",1. Check for third-party antivirus interference. 2. Reinstall Microsoft Office applications. 3. Run Windows Update for system patches. 4. Contact Microsoft Support for specialized assistance.
,"Normal functioning of O365/M365 facing challenges, seeking support",0x80072EFD,"Windows 8, AMD Ryzen 7, 16GB RAM",1. Verify internet connection stability. 2. Check for pending system reboots. 3. Run O365/M365 in Safe Mode to identify conflicts. 4. Review firewall settings for potential restrictions.
,"Issues with smooth operation of O365/M365, seeking assistance",0x80090027,"Windows 10 Home, Intel i3, 8GB RAM",1. Clear Office credentials cache. 2. Run Windows Update for the latest updates. 3. Check for conflicting browser extensions. 4. Reinstall O365/M365 applications.
,"O365/M365 not functioning as expected, seeking help",0x800B0109,"Windows 7, AMD Ryzen 5, 16GB RAM",1. Run O365/M365 in Compatibility Mode. 2. Check for pending Windows updates. 3. Verify antivirus exclusions for Office files. 4. Contact Microsoft Support for advanced troubleshooting.
,"Regular functionality of O365/M365 hindered, seeking intervention",0x800F081F,"Windows 10 Pro, Intel i5, 8GB RAM",1. Verify system requirements for O365/M365. 2. Run Windows Update troubleshooter. 3. Check for conflicting security software. 4. Reinstall Microsoft Office applications.
,System signaling reboot due to pending Windows updates,,"Windows 8.1, AMD Ryzen 9, 64GB RAM","1. Check Windows Update settings for pending updates. 2. Schedule a system restart during non-working hours. 3. Adjust ""Active Hours"" to prevent automatic restarts. 4. Troubleshoot any update-related errors."
,"Operational challenges with O365/M365, seeking assistance",0xC004C003,"Windows 10, Intel i7, 16GB RAM",1. Verify internet connection stability. 2. Run Windows Update for the latest updates. 3. Check for conflicting browser extensions. 4. Reinstall O365/M365 applications.
,Unresolved pending reboots on my system for Windows updates,,"Windows 10, Intel i7, 16GB RAM","1. Open Command Prompt as Administrator and run ""gpupdate /force"". 2. Check for any active installations in Windows Update. 3. Manually restart the system. 4. If the issue persists, check Windows Event Viewer for related errors."
,"Technical hitches affecting O365/M365, seeking support",0x800F081F,"Windows 8, AMD Ryzen 7, 16GB RAM",1. Verify system requirements for O365/M365. 2. Run Windows Update troubleshooter. 3. Check for conflicting security software. 4. Reinstall Microsoft Office applications.
